{
  "schemaVersion": "1.0",
  "planning": {
    "strategy": "sentence-boundary-proportional",
    "durationSource": "ffprobe",
    "targetShots": 59
  },
  "shots": [
    {
      "id": "shot-001",
      "index": 0,
      "sentenceId": "sentence-001",
      "sectionId": "n001",
      "image": "scene01.png",
      "motionIndex": 0,
      "startSec": 0,
      "speechEndSec": 9.341852,
      "endSec": 9.341852,
      "cues": [
        {
          "startSec": 0.100031,
          "endSec": 5.669731,
          "text": "For the first few decades of life, progress usually means adding something."
        },
        {
          "startSec": 5.619715,
          "endSec": 7.637331,
          "text": "More skills."
        },
        {
          "startSec": 7.637331,
          "endSec": 9.341852,
          "text": "More money."
        }
      ]
    },
    {
      "id": "shot-002",
      "index": 1,
      "sentenceId": "sentence-001",
      "sectionId": "n001",
      "image": "scene01.png",
      "motionIndex": 1,
      "startSec": 9.341852,
      "speechEndSec": 17.782428,
      "endSec": 17.782428,
      "cues": [
        {
          "startSec": 0,
          "endSec": 2.003611,
          "text": "More friends."
        },
        {
          "startSec": 2.003611,
          "endSec": 3.979214,
          "text": "A better job."
        },
        {
          "startSec": 3.979214,
          "endSec": 5.953817,
          "text": "A bigger home."
        },
        {
          "startSec": 5.953817,
          "endSec": 8.440576,
          "text": "More experiences."
        }
      ]
    },
    {
      "id": "shot-003",
      "index": 2,
      "sentenceId": "sentence-001",
      "sectionId": "n001",
      "image": "scene01.png",
      "motionIndex": 0,
      "startSec": 17.782428,
      "speechEndSec": 26.208,
      "endSec": 26.808,
      "pauseAfterSec": 0.6,
      "cues": [
        {
          "startSec": 0,
          "endSec": 2.102642,
          "text": "More options."
        },
        {
          "startSec": 2.102642,
          "endSec": 5.399648,
          "text": "When you're young, this makes sense."
        },
        {
          "startSec": 5.399648,
          "endSec": 8.425572,
          "text": "Your world is still expanding."
        }
      ]
    },
    {
      "id": "shot-004",
      "index": 3,
      "sentenceId": "sentence-002",
      "sectionId": "n002",
      "image": "scene02.png",
      "motionIndex": 1,
      "startSec": 0,
      "speechEndSec": 8.15552,
      "endSec": 8.15552,
      "cues": [
        {
          "startSec": 0.100031,
          "endSec": 8.15552,
          "text": "You don't know where you'll live, what kind of work you'll do, who you'll become, or what kind of life you'll eventually build."
        },
        {
          "startSec": 8.105504,
          "endSec": 8.15552,
          "text": "So you collect possibilities."
        }
      ]
    },
    {
      "id": "shot-005",
      "index": 4,
      "sentenceId": "sentence-002",
      "sectionId": "n002",
      "image": "scene02.png",
      "motionIndex": 0,
      "startSec": 8.15552,
      "speechEndSec": 10.933378,
      "endSec": 10.933378,
      "cues": [
        {
          "startSec": 0,
          "endSec": 2.777858,
          "text": "So you collect possibilities."
        }
      ]
    },
    {
      "id": "shot-006",
      "index": 5,
      "sentenceId": "sentence-002",
      "sectionId": "n002",
      "image": "scene02.png",
      "motionIndex": 1,
      "startSec": 10.933378,
      "speechEndSec": 13.065037,
      "endSec": 13.065037,
      "cues": [
        {
          "startSec": 0,
          "endSec": 2.131659,
          "text": "You say yes."
        }
      ]
    },
    {
      "id": "shot-007",
      "index": 6,
      "sentenceId": "sentence-002",
      "sectionId": "n002",
      "image": "scene02.png",
      "motionIndex": 0,
      "startSec": 13.065037,
      "speechEndSec": 15.196695,
      "endSec": 15.196695,
      "cues": [
        {
          "startSec": 0,
          "endSec": 2.131658,
          "text": "You try things."
        }
      ]
    },
    {
      "id": "shot-008",
      "index": 7,
      "sentenceId": "sentence-002",
      "sectionId": "n002",
      "image": "scene02.png",
      "motionIndex": 1,
      "startSec": 15.196695,
      "speechEndSec": 17.583433,
      "endSec": 17.583433,
      "cues": [
        {
          "startSec": 0,
          "endSec": 2.386738,
          "text": "You keep doors open."
        }
      ]
    },
    {
      "id": "shot-009",
      "index": 8,
      "sentenceId": "sentence-002",
      "sectionId": "n002",
      "image": "scene02.png",
      "motionIndex": 0,
      "startSec": 17.583433,
      "speechEndSec": 22.656,
      "endSec": 23.256,
      "pauseAfterSec": 0.6,
      "cues": [
        {
          "startSec": 0,
          "endSec": 5.072567,
          "text": "And for a while, having more choices feels exactly like freedom."
        }
      ]
    },
    {
      "id": "shot-010",
      "index": 9,
      "sentenceId": "sentence-003",
      "sectionId": "n003",
      "image": "scene03.png",
      "motionIndex": 1,
      "startSec": 0,
      "speechEndSec": 9.873907,
      "endSec": 9.873907,
      "cues": [
        {
          "startSec": 0.10009,
          "endSec": 4.493053,
          "text": "But somewhere along the way, something begins to change."
        },
        {
          "startSec": 4.443008,
          "endSec": 7.342624,
          "text": "Not necessarily at forty."
        },
        {
          "startSec": 7.342624,
          "endSec": 9.873907,
          "text": "Not on your birthday."
        }
      ]
    },
    {
      "id": "shot-011",
      "index": 10,
      "sentenceId": "sentence-003",
      "sectionId": "n003",
      "image": "scene03.png",
      "motionIndex": 0,
      "startSec": 9.873907,
      "speechEndSec": 17.736,
      "endSec": 18.336,
      "pauseAfterSec": 0.6,
      "cues": [
        {
          "startSec": 0,
          "endSec": 5.402874,
          "text": "There isn't a particular morning when you wake up and suddenly understand your life."
        },
        {
          "startSec": 5.402874,
          "endSec": 7.862093,
          "text": "It's more subtle than that."
        }
      ]
    },
    {
      "id": "shot-012",
      "index": 11,
      "sentenceId": "sentence-004",
      "sectionId": "n004",
      "image": "scene04.png",
      "motionIndex": 1,
      "startSec": 0,
      "speechEndSec": 8.267816,
      "endSec": 8.267816,
      "cues": [
        {
          "startSec": 0.100095,
          "endSec": 5.445147,
          "text": "You start noticing that every new thing you add also asks something from you."
        },
        {
          "startSec": 5.3951,
          "endSec": 8.267816,
          "text": "Every possession needs space."
        }
      ]
    },
    {
      "id": "shot-013",
      "index": 12,
      "sentenceId": "sentence-004",
      "sectionId": "n004",
      "image": "scene04.png",
      "motionIndex": 0,
      "startSec": 8.267816,
      "speechEndSec": 18.220224,
      "endSec": 18.220224,
      "cues": [
        {
          "startSec": 0,
          "endSec": 2.772621,
          "text": "Every subscription wants money."
        },
        {
          "startSec": 2.772621,
          "endSec": 5.559255,
          "text": "Every friendship needs time."
        },
        {
          "startSec": 5.559255,
          "endSec": 9.952408,
          "text": "Every ambition creates another standard you can fail to meet."
        }
      ]
    },
    {
      "id": "shot-014",
      "index": 13,
      "sentenceId": "sentence-004",
      "sectionId": "n004",
      "image": "scene04.png",
      "motionIndex": 1,
      "startSec": 18.220224,
      "speechEndSec": 27.504,
      "endSec": 28.104,
      "pauseAfterSec": 0.6,
      "cues": [
        {
          "startSec": 0,
          "endSec": 3.455266,
          "text": "Every opportunity becomes another decision."
        },
        {
          "startSec": 3.455266,
          "endSec": 9.283776,
          "text": "And the things that once made life feel bigger can slowly begin to make it feel crowded."
        }
      ]
    },
    {
      "id": "shot-015",
      "index": 14,
      "sentenceId": "sentence-005",
      "sectionId": "n005",
      "image": "scene05.png",
      "motionIndex": 0,
      "startSec": 0,
      "speechEndSec": 7.793669,
      "endSec": 7.793669,
      "cues": [
        {
          "startSec": 0.100034,
          "endSec": 5.399849,
          "text": "Maybe this is one reason life starts feeling different in middle age."
        },
        {
          "startSec": 5.349832,
          "endSec": 7.793669,
          "text": "The question changes."
        }
      ]
    },
    {
      "id": "shot-016",
      "index": 15,
      "sentenceId": "sentence-005",
      "sectionId": "n005",
      "image": "scene05.png",
      "motionIndex": 1,
      "startSec": 7.793669,
      "speechEndSec": 19.288606,
      "endSec": 19.288606,
      "cues": [
        {
          "startSec": 0,
          "endSec": 5.626927,
          "text": "When you're twenty-five, you might ask: What else can I do?"
        },
        {
          "startSec": 5.626927,
          "endSec": 11.494937,
          "text": "Later, you may find yourself asking: What can I stop doing?"
        }
      ]
    },
    {
      "id": "shot-017",
      "index": 16,
      "sentenceId": "sentence-005",
      "sectionId": "n005",
      "image": "scene05.png",
      "motionIndex": 0,
      "startSec": 19.288606,
      "speechEndSec": 26.28,
      "endSec": 26.88,
      "pauseAfterSec": 0.6,
      "cues": [
        {
          "startSec": 0,
          "endSec": 2.500856,
          "text": "That sounds like giving up."
        },
        {
          "startSec": 2.500856,
          "endSec": 6.991394,
          "text": "But it might actually be the beginning of a different kind of freedom."
        }